{"format_name":"GroundTruthChangeSet","format_version":"1.0.0","feature_id":"holdout-01","required_repositories":[{"repository_id":"feature-delivery-intelligence","revision":"54db6e2879abd5ac8e7319efe8ef06a5b7ae5482"},{"repository_id":"feature-repo-scan","revision":"c1167d23eb1c28826c60ff4928fe047c11cd8a8b"}],"surfaces":[{"surface_id":"holdout-one-context-contract","repository_id":"feature-delivery-intelligence","path":"docs/superpowers/specs/2026-08-29-fdi-context-taxonomy-design.md","symbol_or_anchor":"Evidence identity","critical":true},{"surface_id":"holdout-one-evidence-schema","repository_id":"feature-repo-scan","path":"schemas/evidence.schema.json","symbol_or_anchor":null,"critical":false}],"required_interface_ids":["interface-evidence-record"],"required_validation_ids":["validation-evidence-schema"],"owner_id":"evaluation-owner","reviewer_id":"ground-truth-reviewer-one","approval_state":"FROZEN_APPROVED"}
