{"format_name":"GroundTruthChangeSet","format_version":"1.0.0","feature_id":"holdout-04","required_repositories":[{"repository_id":"feature-delivery-intelligence","revision":"54db6e2879abd5ac8e7319efe8ef06a5b7ae5482"},{"repository_id":"feature-repo-scan","revision":"c1167d23eb1c28826c60ff4928fe047c11cd8a8b"}],"surfaces":[{"surface_id":"holdout-four-selector-contract","repository_id":"feature-delivery-intelligence","path":"docs/superpowers/specs/2026-08-29-fdi-workflow-semantics-design.md","symbol_or_anchor":"Bounded selected-read grammar","critical":true},{"surface_id":"holdout-four-closure-skill","repository_id":"feature-repo-scan","path":"skill/feature-to-multi-repo/SKILL.md","symbol_or_anchor":"Procedure","critical":false}],"required_interface_ids":["interface-selector-policy"],"required_validation_ids":["validation-trigger-boundary"],"owner_id":"evaluation-owner","reviewer_id":"ground-truth-reviewer-four","approval_state":"FROZEN_APPROVED"}
