{"format_name":"GroundTruthChangeSet","format_version":"1.0.0","feature_id":"holdout-03","required_repositories":[{"repository_id":"feature-delivery-intelligence","revision":"54db6e2879abd5ac8e7319efe8ef06a5b7ae5482"},{"repository_id":"feature-repo-scan","revision":"c1167d23eb1c28826c60ff4928fe047c11cd8a8b"}],"surfaces":[{"surface_id":"holdout-three-context-ownership","repository_id":"feature-delivery-intelligence","path":"docs/superpowers/specs/2026-08-29-fdi-context-taxonomy-design.md","symbol_or_anchor":"Multi-repository ownership boundaries","critical":true},{"surface_id":"holdout-three-workflow-runtime","repository_id":"feature-repo-scan","path":"src/main/java/com/featuretorepo/engine/workflow/FeatureClosureWorkflow.java","symbol_or_anchor":"FeatureClosureWorkflow","critical":false}],"required_interface_ids":["interface-closure-state"],"required_validation_ids":["validation-workflow-state"],"owner_id":"evaluation-owner","reviewer_id":"ground-truth-reviewer-three","approval_state":"FROZEN_APPROVED"}
