{"format_name":"GroundTruthChangeSet","format_version":"1.0.0","feature_id":"holdout-02","required_repositories":[{"repository_id":"feature-delivery-intelligence","revision":"54db6e2879abd5ac8e7319efe8ef06a5b7ae5482"},{"repository_id":"feature-repo-scan","revision":"c1167d23eb1c28826c60ff4928fe047c11cd8a8b"}],"surfaces":[{"surface_id":"holdout-two-workflow-contract","repository_id":"feature-delivery-intelligence","path":"docs/superpowers/specs/2026-08-29-fdi-workflow-semantics-design.md","symbol_or_anchor":"Change Set","critical":true},{"surface_id":"holdout-two-blind-command","repository_id":"feature-repo-scan","path":"src/main/java/com/featuretorepo/cli/BlindClosureCommand.java","symbol_or_anchor":"BlindClosureCommand","critical":false}],"required_interface_ids":["interface-replay-input"],"required_validation_ids":["validation-cli-contract"],"owner_id":"evaluation-owner","reviewer_id":"ground-truth-reviewer-two","approval_state":"FROZEN_APPROVED"}
